Title,Citations,Similarities
"A comparative risk assessment of burden of disease and injury attributable to 67 risk factors and risk factor clusters in 21 regions, 1990–2010: a systematic analysis for the Global Burden of Disease Study 2010","13899","0.46274521946907043"
"Disability-adjusted life years (DALYs) for 291 diseases and injuries in 21 regions, 1990–2010: a systematic analysis for the Global Burden of Disease Study 2010","9996","0.36809295415878296"
"Years lived with disability (YLDs) for 1160 sequelae of 289 diseases and injuries 1990–2010: a systematic analysis for the Global Burden of Disease Study 2010","8795","0.48377031087875366"
"Suicide risk and prevention during the COVID-19 pandemic","1270","0.42817679047584534"
"Prevalence of nonsuicidal self‐injury in nonclinical samples: Systematic review, meta‐analysis and meta‐regression","1167","0.2727227210998535"
"Essential epidemiology: an introduction for students and health professionals","497","0.535309374332428"
"The burden attributable to mental and substance use disorders as risk factors for suicide: findings from the Global Burden of Disease Study 2010","452","0.35632646083831787"
"Long-term unemployment and suicide: a systematic review and meta-analysis","333","0.271446168422699"
"Attributable risk of psychiatric and socio-economic factors for suicide from individual-level, population-based studies: a systematic review","317","0.48457440733909607"
"Child maltreatment, subsequent non-suicidal self-injury and the mediating roles of dissociation, alexithymia and self-blame","248","0.41183310747146606"
"Cause and effect in studies on unemployment, mental health and suicide: a meta-analytic and conceptual review","214","0.30761250853538513"
"An integrated national mortality surveillance system for death registration and mortality surveillance, China","212","0.4473113417625427"
"Suicide in Australian farming, 1988–1997","196","0.393196165561676"
"Risk factors for postneonatal, infant, child and under-5 mortality in Nigeria: a pooled cross-sectional analysis","180","0.5745555758476257"
"The impact of antenatal depression on perinatal outcomes in Australian women","166","0.38403964042663574"
"Determinants of neonatal mortality in Nigeria: evidence from the 2008 demographic and health survey","162","0.3568449318408966"
"A comparative risk assessment of burden of disease and injury attributable to 67 risk factors and risk factor clusters in 21 regions, 1990-2010: a systematic analysis for the Global Burden of Disease Study 2010","148","0.4541337192058563"
"Predictors of continuation and cessation of nonsuicidal self-injury","144","0.4705146849155426"
"The impact of physical distancing policies during the COVID-19 pandemic on health and well-being among Australian adolescents","131","0.4775673449039459"
"Royal Australian and New Zealand College of Psychiatrists clinical practice guideline for the management of deliberate self-harm","127","0.3245134949684143"
"Determinants of antenatal depression and postnatal depression in Australia","123","0.45302534103393555"
"Predictors of onset for non-suicidal self-injury within a school-based sample of adolescents","117","0.3534436523914337"
"Mental health and socio-economic variations in Australian suicide","0","0.49218231439590454"
"The impact of water and sanitation on childhood mortality in Nigeria: evidence from demographic and health surveys, 2003–2013","115","0.4864237904548645"
"Geographical variation in diabetes prevalence and detection in China: multilevel spatial analysis of 98,058 adults","114","0.3861735761165619"
"Infant feeding practices and diarrhoea in sub-Saharan African countries with high diarrhoea mortality","0","0.6033276319503784"
"Determinants of inadequate complementary feeding practices among children aged 6–23 months in Ghana","104","0.371245801448822"
"The decline in Australian young male suicide","102","0.41829121112823486"
"Socio-economic differentials in mental disorders and suicide attempts in Australia","101","0.28273430466651917"
"Determinants of suboptimal breastfeeding practices in Nigeria: evidence from the 2008 demographic and health survey","100","0.39583730697631836"
"Prevalence and determinants of cessation of exclusive breastfeeding in the early postnatal period in Sydney, Australia","96","0.4051826298236847"
"Applications of system dynamics modelling to support health policy","93","0.6032024025917053"
"Social and psychiatric influences on urban–rural differentials in Australian suicide","89","0.6073369979858398"
"Trends in complementary feeding indicators in Nigeria, 2003–2013","88","0.44262877106666565"
"The prevalence of sexually transmitted infections in Papua New Guinea: a systematic review and meta-analysis","86","0.26203855872154236"
"Risk factors for under-5 mortality: evidence from Bangladesh Demographic and Health Survey, 2004–2011","85","0.4979858696460724"
"Suicide by pesticide poisoning remains a priority for suicide prevention in China: analysis of national mortality trends 2006–2013","84","0.43566158413887024"
"Suicidal ideation, suicide attempts and non-suicidal self-injury among lesbian, gay, bisexual and heterosexual adults: Findings from an Australian national study","82","0.39040929079055786"
"Further increases in rural suicide in young Australian adults: secular trends, 1979–2003","82","0.4292871356010437"
"Suicide and political regime in New South Wales and Australia during the 20th century","82","0.39612144231796265"
"Trends and determinants of early initiation of breastfeeding and exclusive breastfeeding in Ethiopia from 2000 to 2016","81","0.3700234591960907"
"A modelling tool for policy analysis to support the design of efficient and effective policy responses for complex public health problems","78","0.3441733717918396"
"Social determinants of discharge destination for patients after stroke with low admission FIM instrument scores","78","0.49664080142974854"
"Cerebrovascular disease in 48 countries: secular trends in mortality 1950–2005","76","0.4059390127658844"
"Divergent trends in suicide by socio-economic status in Australia","72","0.39333271980285645"
"Regional prevalence and determinants of exclusive breastfeeding in India","71","0.5627588033676147"
"The effect of solid fuel use on childhood mortality in Nigeria: evidence from the 2013 cross-sectional household survey","64","0.3950607478618622"
"Determinants of suboptimal complementary feeding practices among children aged 6–23 months in four anglophone W est A frican countries","60","0.5739833116531372"
"Diarrhoea and suboptimal feeding practices in Nigeria: evidence from the national household surveys","59","0.6188172101974487"
"Duration of unemployment and suicide in Australia over the period 1985–2006: an ecological investigation by sex and age during rising versus declining national unemployment rates","56","0.5217671990394592"
"The burden of depressive disorders in South Asia, 1990–2016: findings from the global burden of disease study","54","0.4391625225543976"
"Household air pollution from use of cooking fuel and under-five mortality: The role of breastfeeding status and kitchen location in Pakistan","54","0.378127783536911"
"The association between infant and young child feeding practices and diarrhoea in Tanzanian children","52","0.4393066167831421"
"Trends and socio-economic determinants of suicide in India: 2001–2013","51","0.48199263215065"
"Suicide in young adults: psychiatric and socio-economic factors from a case–control study","50","0.42082929611206055"
"Parental socio-economic position during childhood as a determinant of self-harm in adolescence","50","0.4123688042163849"
"Household air pollution and under-five mortality in India (1992–2006)","49","0.423309862613678"
"Trends and predictors of prelacteal feeding practices in Nigeria (2003–2013)","47","0.4967687726020813"
"Spatial clusters of suicide in Australia","47","0.39149245619773865"
"Comparison of the validity and reliability of two image classification systems for the assessment of mammogram quality","47","0.4703028202056885"
"Suicide differentials in Australian males and females by various measures of socio‐economic status, 1994–98","47","0.621384859085083"
"Surveillance of Australian suicidal behaviour using the internet?","44","0.42272233963012695"
"Spatiotemporal variation and social determinants of suicide in China, 2006–2012: findings from a nationally representative mortality surveillance system","42","0.3664296567440033"
"The effectiveness of suicide prevention delivered by GPs: a systematic review and meta-analysis","41","0.4195830225944519"
"Determinants of trends in breast-feeding indicators in Nigeria, 1999–2013","41","0.3653436601161957"
"The role of under-employment and unemployment in recent birth cohort effects in Australian suicide","41","0.5421255230903625"
"Sociodemographic correlates of antidepressant utilisation in Australia","41","0.5794817805290222"
"Household air pollution and under-five mortality in Bangladesh (2004–2011)","40","0.5279216766357422"
"Internet searches for a specific suicide method follow its high-profile media coverage","40","0.3712073564529419"
"Effectiveness of Australian youth suicide prevention initiatives","39","0.3869921863079071"
"The impact of antenatal care, iron–folic acid supplementation and tetanus toxoid vaccination during pregnancy on child mortality in Bangladesh","38","0.37490880489349365"
"Determinants of suboptimal complementary feeding practices among children aged 6–23 months in seven francophone W Est a frican countries","37","0.5692457556724548"
"Population attributable risk of modifiable risk factors associated with invasive breast cancer in women aged 45–69 years in Queensland, Australia","37","0.43839240074157715"
"Modifiable risk factors for attempted suicide in Australian clinical and community samples","36","0.6008042693138123"
"Adjustment for physical activity in studies of sedentary behaviour","34","0.35256484150886536"
"Global comparative assessments of life expectancy: the impact of migration with reference to Australia","34","0.5184851288795471"
"Birth cohort effects in New South Wales suicide, 1865–1998","33","0.5925155878067017"
"The impact of sociodemographic and health-service factors on breast-feeding in sub-Saharan African countries with high diarrhoea mortality","0","0.6088292598724365"
"Associations between climate variability, unemployment and suicide in Australia: a multicity study","32","0.4312822222709656"
"Determinants of early introduction of solid, semi-solid or soft foods among infants aged 3–5 months in four Anglophone West African countries","30","0.4979509115219116"
"The Australian epidemic of cardiovascular mortality 1935–2005: effects of period and birth cohort","30","0.4479144215583801"
"Recruitment to mammography screening: a randomised trial and meta‐analysis of invitation letters and telephone calls","30","0.5821564793586731"
"Predictors of non‐attendance from BreastScreen NSW in women who report current mammography screening","29","0.5890504717826843"
"Tuberculosis disease burden and attributable risk factors in Nigeria, 1990–2016","28","0.38693541288375854"
"A decision-support tool to inform Australian strategies for preventing suicide and suicidal behaviour","0","0.5887752771377563"
"Trends and factors associated with complementary feeding practices in Ethiopia from 2005 to 2016","27","0.6335996985435486"
"Systematic review of reporting rates of adverse events following immunization: an international comparison of post-marketing surveillance programs with reference to China","27","0.48286983370780945"
"Trends in socioeconomic inequalities in mortality from ischaemic heart disease and stroke in Australia, 1979–2006","27","0.3352598249912262"
"A decision support tool to inform local suicide prevention activity in Greater Western Sydney (Australia)","26","0.4305661916732788"
"Systems modelling tools to support policy and planning","26","0.4047594368457794"
"Assessment of provider-initiated HIV screening in Nigeria with sub-Saharan African comparison","26","0.39305543899536133"
"General practitioner attitudes to prescribing hepatitis C antiviral therapy in a community setting","26","0.24821722507476807"
"Mental disorders and socioeconomic status: impact on population risk of attempted suicide in Australia","26","0.6047892570495605"
"The prevalence of diabetes among adults aged 40 years and over in Fiji","25","0.36555519700050354"
"Suicide by hanging is a priority for suicide prevention: method specific suicide in India (2001–2014)","24","0.4649028778076172"
"Spatiotemporal variation in diabetes mortality in China: multilevel evidence from 2006 and 2012","24","0.3698031008243561"
"The effects of involuntary job loss on suicide and suicide attempts among young adults: Evidence from a matched case–control study","24","0.3843521177768707"
"Cancer detection and mammogram volume of radiologists in a population-based screening programme","24","0.5216608047485352"
"Population-based mammography screening and breast cancer incidence in New South Wales, Australia","23","0.38920140266418457"
"Unemployment and youth suicide","23","0.3844946622848511"
"Static metrics of impact for a dynamic problem: The need for smarter tools to guide suicide prevention planning and investment","22","0.3395955562591553"
"Factors influencing risk of premature mortality in community cases of depression: a meta-analytic review","22","0.46026214957237244"
"Suicide in paradise: aftermath of the Bali bombings","22","0.3996061086654663"
"Intimate partner violence identified through routine antenatal screening and maternal and perinatal health outcomes","21","0.45419037342071533"
"Determinants of exclusive breastfeeding cessation in the early postnatal period among culturally and linguistically diverse (CALD) Australian mothers","21","0.4888339638710022"
"The impact of strengthening mental health services to prevent suicidal behaviour","21","0.3918035626411438"
"Have policy responses in Nigeria resulted in improvements in infant and young child feeding practices in Nigeria?","21","0.4342356026172638"
"Reforming mental health in China and India","21","0.4774090349674225"
"Stability and instability of subjective well-being in the transition from adolescence to young adulthood: Longitudinal evidence from 20991 young Australians","21","0.3008780777454376"
"Dynamic pattern of suicide in Australia, 1986–2005: a descriptive-analytic study","21","0.4348369836807251"
"SMS SOS: a randomized controlled trial to reduce self-harm and suicide attempts using SMS text messaging","20","0.39049091935157776"
"Development of the Australian neighborhood social fragmentation index and its association with spatial variation in depression across communities","20","0.29424217343330383"
"Population attributable risk of key modifiable risk factors associated with non-exclusive breastfeeding in Nigeria","20","0.44689714908599854"
"Geographical inequality in tobacco control in china: multilevel evidence from 98 058 participants","20","0.440723717212677"
"All-age hospitalization rates in coal seam gas areas in Queensland, Australia, 1995–2011","20","0.38285031914711"
"Factors associated with early introduction of formula and/or solid, semi-solid or soft foods in seven Francophone West African countries","20","0.5044082999229431"
"Mammography screening participation: Effects of a media campaign targeting Italian‐speaking women","20","0.60023432970047"
"Trends and factors associated with the utilisation of antenatal care services during the Millennium Development Goals era in Tanzania","19","0.4390161633491516"
"Utilisation trends of rosiglitazone and pioglitazone in Australia before and after safety warnings","19","0.3887927532196045"
"Diarrhoea deaths and disability-adjusted life years attributable to suboptimal breastfeeding practices in Nigeria: findings from the global burden of disease study 2016","18","0.40946006774902344"
"The effect of leaving employment on mental health: testing ‘adaptation’versus ‘sensitisation’in a cohort of working-age Australians","18","0.5108888149261475"
"Breast cancer risk factors in Queensland women attending population-based mammography screening","18","0.426217645406723"
"National suicide prevention strategies: A comparison","18","0.525977373123169"
"Impacts of licensed premises trading hour policies on alcohol‐related harms","17","0.6159784197807312"
"Recent declines in Australian male suicide are real, not artefactual","17","0.45918604731559753"
"The geographic heterogeneity of suicide rates in India by religion, caste, tribe, and other backward classes.","16","0.47263002395629883"
"Factors influencing suicide in older rural males: a review of Australian studies","16","0.429210364818573"
"Predictors of stillbirths in Bangladesh: evidence from the 2004–2014 nation-wide household surveys","16","0.37191739678382874"
"Spatiotemporal variations in lung cancer mortality in China between 2006 and 2012: a multilevel analysis","16","0.48136359453201294"
"Age-specific interval breast cancers in New South Wales and meta-analysis of studies of women aged 40–49 years","16","0.4487147033214569"
"Health reform and mortality in China: multilevel time-series analysis of regional and socioeconomic inequities in a sample of 73 million","14","0.46088090538978577"
"Pharmacoepidemiology and the Australian regional prevalence of multiple sclerosis","14","0.41362372040748596"
"Associations between infant and young child feeding practices and acute respiratory infection and diarrhoea in Ethiopia: A propensity score matching approach","13","0.363087922334671"
"Infant abusive head trauma incidence in Queensland, Australia","13","0.4967404007911682"
"Body mass index among Melanesian and Indian Fijians aged≥ 40 years living in Fiji","13","0.3924639821052551"
"Domestic violence and self-poisoning in Sri Lanka","0","0.5514003038406372"
"Factors associated with underweight, overweight, and obesity in reproductive age Tanzanian women","12","0.3171965479850769"
"The impact of reducing psychiatric beds on suicide rates","12","0.429532527923584"
"Attributable risk and potential impact of interventions to reduce household air pollution associated with under-five mortality in South Asia","12","0.4231218695640564"
"Widening socioeconomic inequalities in Australian suicide, despite recent declines in suicide rates","12","0.4515734016895294"
"Spatiotemporal variations in chronic obstructive pulmonary disease mortality in China: multilevel evidence from 2006 to 2012","12","0.3973192572593689"
"Social connections and suicidal behaviour in young Australian adults: Evidence from a case–control study of persons aged 18–34 years in NSW, Australia","12","0.41470497846603394"
"Risk factors for postneonatal, infant, child and under-5 mortality in Nigeria: a pooled cross-sectional analysis. BMJ open. 2015; 5 (3): e006779","12","0.5681256651878357"
"Examination of child and adolescent hospital admission rates in Queensland, Australia, 1995–2011: A comparison of coal seam gas, coal mining, and rural areas","11","0.4096887707710266"
"Risk factors associated with injury and mortality from paediatric low speed vehicle incidents: a systematic review","11","0.22083039581775665"
"The health and safety of SA farmers, farm families and farm workers","11","0.502022922039032"
"The CSG arena: a critical review of unconventional gas developments and best-practice health impact assessment in Queensland, Australia","10","0.4634876251220703"
"Potential impacts of modifiable behavioral and environmental exposures on reducing burden of under-five mortality associated with household air pollution in Nepal","10","0.41169893741607666"
"Multiple sclerosis disease modifying medicine utilisation in Australia","10","0.3895356059074402"
"Low‐speed vehicle run over fatalities in A ustralian children aged 0–5 years","10","0.5661841630935669"
"Upstairs and downstairs: socio-economic and gender interactions in herpes simplex virus type 2 seroprevalence in Australia","10","0.292105495929718"
"Recall of farm hazards in Australian primary school age children using a 3‐d visual cue test","10","0.6066319942474365"
"Estimating patterns in the under-reporting of suicide deaths in India: comparison of administrative data and Global Burden of Disease Study estimates, 2005–2015","9","0.5330290794372559"
"Trends and determinants of underweight and overweight/obesity among urban Ethiopian women from 2000 to 2016","9","0.5617451071739197"
"Temporal trends and geographic variations in dementia mortality in China between 2006 and 2012","9","0.3095567226409912"
"Analysis of health service amenable and non-amenable mortality before and since China's expansion of health coverage in 2009","9","0.464415043592453"
"Changes in method specific suicide following a national pesticide ban in India (2011–2014)","8","0.5149455666542053"
"Is increasing coal seam gas well development activity associated with increasing hospitalisation rates in Queensland, Australia? An exploratory analysis 1995–2011","8","0.5246245861053467"
"The Artificial University: decision support for universities in the COVID-19 era","7","0.35621872544288635"
"Global Maternal and Child Health Research collaboration (GloMACH)(2020). Associations between infant and young child feeding practices and acute respiratory infection and diarrhoea in Ethiopia: A propensity score matching approach","7","0.4790990352630615"
"Perinatal distress and depression in culturally and linguistically diverse (CALD) Australian women: The role of psychosocial and obstetric factors","7","0.5135910511016846"
"Confluence of suicide and drug overdose epidemics in young Australian males: common causality?","7","0.39161163568496704"
"Lifting the lid on geographic complexity in the relationship between body mass index and education in China","7","0.386887788772583"
"Socioeconomic and geographic correlates of intimate partner violence in Sri Lanka: Analysis of the 2016 Demographic and Health Survey","6","0.3849068582057953"
"The impact of transitions from employment to retirement on suicidal behaviour among older aged Australians","6","0.42853838205337524"
"BreastScreen Aotearoa: Independent Monitoring Report, Screening and assessment report of women attending BSA","6","0.5535609126091003"
"Using the'presenting problem'field in emergency department data improves the enumeration of intentional self-harm in NSW hospital settings","5","0.41401124000549316"
"Development of a self-harm monitoring system for Victoria","5","0.5089335441589355"
"Australian Suicide Prevention using Health-Linked Data (ASHLi): Protocol for a population-based case series study","5","0.5226114392280579"
"Suicide in India during the first year of the COVID-19 pandemic","4","0.5410522222518921"
"Ensuring older Australians remain socially connected during the COVID-19 isolation period","4","0.4694196581840515"
"Determinants of treatment non-attendance among those referred to primary mental health care services in Western Sydney, Australia: a retrospective cohort study","4","0.5106493830680847"
"Is the reported increase in young female hospital-treated intentional self-harm real or artefactual?","4","0.4406950771808624"
"A rise in Australian suicide? A reflection on the 2016 cause of death statistics","4","0.48226019740104675"
"The association of diabetes and BMI among Melanesian and Indian Fijians aged≥ 40 years","4","0.3516588807106018"
"Low education and mental health among older adults: the mediating role of employment and income","3","0.42682164907455444"
"Alcohol‐related suicide across Australia: a geospatial analysis","3","0.5911089181900024"
"Mapping Geographical Differences and Examining the Determinants of Childhood Stunting in Ethiopia: A Bayesian Geostatistical Analysis","3","0.4820149838924408"
"[In Press] Impact of Covid-19 physical distancing policies on incidence of intentional self-harm in Western Sydney","3","0.4866624176502228"
"This article is intended solely for the personal use of the individual user and is not to be disseminated broadly","3","0.649761974811554"
"Geographical variation and correlates of tobacco smoking, second-hand smoke exposure, workplace tobacco prohibition, and pro-tobacco and counter-tobacco advertising in mainland China: a cross-sectional study of 98 058 participants","3","0.41754570603370667"
"When the presumption of innocence is not beneficial: periodic presumptive treatment for STIs and HIV in female sex workers","3","0.36912453174591064"
"BreastScreen Aotearoa Independent Monitoring Report: Screening and Assessment Report of Women Attending BSA (Women Screened January 2008 to December 2009)","3","0.4661139249801636"
"BreastScreen Aotearoa: Independent monitoring report, July-December 2006","3","0.5392249226570129"
"Cost-effectiveness of installing barriers at bridge and cliff sites for suicide prevention in Australia","2","0.3559105098247528"
"“Watch Me Grow-Electronic (WMG-E)” surveillance approach to identify and address child development, parental mental health, and psychosocial needs: study protocol","2","0.4578433036804199"
"Trends and determinants of HIV transmission among men who inject drugs in the Pokhara Valley, Nepal: analysis of cross-sectional studies","2","0.36127710342407227"
"Interventions to improve infant and young child feeding practices in Ethiopia: a systematic review","2","0.48242276906967163"
"Environmentally-related health impact assessment of coal seam gas development activities in Queensland, Australia","2","0.4769412577152252"
"BREASTSCREEN AOTEAROA INDEPENDENT MONITORING REPORT","2","0.6404903531074524"
"“It's much easier than going to the dentist”: high levels of satisfaction in a mammography screening program","2","0.6127911806106567"
