Title,Citations,Similarities
"Engineering of Human Mesenchymal Stem/Stromal Cells with Vascular Endothelial Growth Factor–Encoding Minicircles for Angiogenic Ex Vivo Gene Therapy","15","0.5232669711112976"
"G protein-coupled receptors: an overview of signaling mechanisms and screening assays","15","0.4868597984313965"
"On the dual effect of glucose during production of pBAD/AraC-based minicircles","15","0.5145277380943298"
"Integration of thin film amorphous silicon photodetector with lab-on-chip for monitoring protein fluorescence in solution and in live microbial cells","15","0.5028639435768127"
"Stabilization of naked and condensed plasmid DNA against degradation induced by ultrasounds and high‐shear vortices","15","0.5840296149253845"
"Colorimetric detection of molecular recognition reactions with an enzyme biolabel using a thin-film amorphous silicon photodiode on a glass substrate","15","0.5864556431770325"
"Monitoring of process streams in the large‐scale production and purification of plasmid DNA for gene therapy applications","15","0.5442251563072205"
"Colorimetric detection of D-dimer in a paper-based immunodetection device","14","0.573573887348175"
"Improvement of DNA minicircle production by optimization of the secondary structure of the 5′-UTR of ParA resolvase","14","0.4205508530139923"
"General aspects of biomimetic materials","14","0.3819180428981781"
"Application of factorial design to the study of an alcoholysis transformation promoted by cutinase immobilized on NaY zeolite and Accurel PA6","14","0.5715007781982422"
"Quantitation of plasmid DNA in aqueous two-phase systems by fluorescence analysis","14","0.48724332451820374"
"Protein assay in reversed micelle solutions","14","0.593515932559967"
"Purification of Plasmid DNA Vectors Produced in Escherichia coli for Gene Therapy and DNA Vaccination Applications","13","0.5427688360214233"
"Conformational changes induced by immobilization of a recombinant cutinase on zeolites","13","0.5132266283035278"
"Plasmid manufacturing–an overview","13","0.5830820798873901"
"Titanosilicates as supports for an enzymatic alcoholysis reaction","13","0.46610984206199646"
"A biomolecular recognition approach for the functionalization of cellulose with gold nanoparticles","12","0.5452515482902527"
"Monitoring intracellular calcium in response to GPCR activation using thin-film silicon photodiodes with integrated fluorescence filters","12","0.5936731100082397"
"Detection of fluorescently labeled biomolecules immobilized on a detachable substrate using an integrated amorphous silicon photodetector","12","0.5725250840187073"
"Chemiluminescent bead-based hybridization assay for the detection of genomic DNA from E. coli in purified plasmid samples","12","0.5312746167182922"
"Detection of molecular tags with an integrated amorphous silicon photodetector for biological applications","12","0.536188542842865"
"Kinetic and stability studies of penicillin acylase in reversed micelles","12","0.5895371437072754"
"Separation of plasmid DNA topoisomers by multimodal chromatography","11","0.5413590669631958"
"Electrical detection of DNA immobilization and hybridization by streaming current measurements in microchannels","11","0.4829590320587158"
"Purification of plasmid DNA from Escherichia coli ferments using anion‐exchange membrane and hydrophobic chromatography","11","0.5747860074043274"
"Microbial Stereoselective Oxidation of 2-methyl-1,3-propanediol to (R)-β-hydroxyisobutyric Acid in Aqueous/organic Biphasic Systems","11","0.5342813730239868"
"Purification of plasmid (pVaxLacZ) by hydrophobic interaction chromatography","10","0.47274506092071533"
"Minicircle biopharmaceuticals–an overview of purification strategies","9","0.4759811758995056"
"Monitoring Proteolytic Activity in Real Time: A New World of Opportunities for Biosensors","9","0.535110354423523"
"Impact of plasmid size on the purification of model plasmid DNA vaccines by phenyl membrane adsorbers","9","0.4652504026889801"
"Streaming currents in microfluidics with integrated polarizable electrodes","9","0.38060620427131653"
"Protein-DNA interactions define the mechanistic aspects of circle formation and insertion reactions in IS2 transposition","9","0.37476372718811035"
"Characterisation of hydrogenated silicon–carbon alloy filters with different carbon composition for on-chip fluorescence detection of biomolecules","9","0.4994361102581024"
"Comparative analysis of antigen-targeting sequences used in DNA vaccines","9","0.4212949275970459"
"Comparison of amorphous silicon photodiodes and photoconductors for detection of quantum dot biomolecular tags","9","0.5305388569831848"
"The effect of the shape of single, sub-ms voltage pulses on the rates of surface immobilization and hybridization of DNA","9","0.39997348189353943"
"Plasmid DNA","9","0.5783098340034485"
"The effect of stirring and seeding on the AcPheLeuNH2 synthesis and crystallization in a reversed micellar system","9","0.5220174789428711"
"Fluorescence correlation spectroscopy study of the complexation of DNA hybrids, IgG antibody, and a chimeric protein of IgG-binding ZZ domains fused with a carbohydrate binding module","8","0.4500884711742401"
"Development of a phenyl membrane chromatography-based process yielding pharmaceutical grade plasmid deoxyribonucleic acid for mammalian cells transfection","8","0.5854067802429199"
"Study on the scale-up of human IgG3 purification using protein A affinity chromatography","8","0.5364543795585632"
"Organic media selection for the extraction of β‐hydroxyisobutyric acid produced by microbial biotransformation","8","0.5539548993110657"
"Batch and continuous lipolysis/product separation in a reversed micellar membrane bioreactor","8","0.5800228714942932"
"Fluorescent dye nano-assemblies by thiol attachment directed to the tips of gold nanorods for effective emission enhancement","7","0.381990909576416"
"Density gradient selection of colloidal silver nanotriangles for assembling dye-particle plasmophores","7","0.5594506859779358"
"Re-engineering of an Escherichia coli K-12 strain for the efficient production of recombinant human Interferon Gamma","7","0.35741138458251953"
"Production and Purification of Supercoiled Minicircles by a Combination of In Vitro Endonuclease Nicking and Hydrophobic Interaction Chromatography","7","0.528184175491333"
"Considerations on the Use of Enzymes in the Downstream Processing of Biopharmaceuticals","7","0.4473477900028229"
"Biotechnologies and biomimetics for civil engineering","7","0.5909091234207153"
"Evidence that the insertion events of IS2 transposition are biased towards abrupt compositional shifts in target DNA and modulated by a diverse set of culture parameters","7","0.2773943245410919"
"Integrated detection of intrinsic fluorophores in live microbial cells using an array of thin film amorphous silicon photodetectors","7","0.5163338780403137"
"The role of probe–probe interactions on the hybridization of double-stranded DNA targets onto DNA-modified magnetic microparticles","7","0.4947352111339569"
"Extraction of dengue 2 plasmid DNA vaccine (pD2) from cell lysates by aqueous two-phase systems","7","0.4548061192035675"
"Optimal design of n membrane reactors in series using michaelis‐menten kinetics","7","0.5913266539573669"
"Colorimetric assays for the determination of dioctyl sodium sulphosuccinate and glycerol in reversed micelles","7","0.5335482954978943"
"Colorimetric Detection of DNA Strands on Cellulose Microparticles Using ZZ–CBM Fusions and Gold Nanoparticles","6","0.53248530626297"
"Validation and scale‐up of plasmid DNA purification by phenyl‐boronic acid chromatography","6","0.5840741395950317"
"Mutation detection in plasmid‐based biopharmaceuticals","6","0.5590643882751465"
"Ionic Conductivity Measurements in a SiO2 Nanochannel with PDMS Interconnects","6","0.4156385660171509"
"Evaluation of the effect of non-B DNA structures on plasmid integrity via accelerated stability studies","6","0.5117776393890381"
"Quantitative structure activity relationships in the synthesis of AcXYNH2 dipeptides by α-chymotrypsin in reversed micelles","6","0.545734703540802"
"Production and purification of adenovirus vectors for gene therapy","5","0.45994362235069275"
"Chemical synthesis and crystallization of the dipeptide AcPheIleNH2 in TTAB/heptane/octanol reversed micelles","5","0.5693378448486328"
"Enzymatic Membrane Bioreactors: Current State of the Art and Future Prospects","5","0.3873830735683441"
"Affinity-Based Magnetic Particles for the Purification of Single-Stranded DNA Scaffolds for Biomanufacturing DNA-Origami Nanostructures","4","0.4543602466583252"
"Functionalization of cellulose-based hydrogels with bi-functional fusion proteins containing carbohydrate-binding modules","4","0.6202181577682495"
"Gold nanotriangles as selective catalysts for cyclohexanol and cyclohexanone production","4","0.5701395869255066"
"DNA instability in bacterial genomes: Causes and consequences","4","0.3763188123703003"
"Enhancement of DNA vaccine efficacy by intracellular targeting strategies","4","0.4842446744441986"
"Amorphous silicon photosensors for detection of intrinsic cell fluorophores","4","0.5024757385253906"
"Lab-on-a-Chip ochratoxin a detection using competitive ELISA in microfluidics with integrated photodiode signal acquisition","4","0.5171247720718384"
"Optimization of DNA hybridization on aminopropyl-controlled pore-glass particles: Detection of non-labeled targets by picogreen staining","4","0.5447961688041687"
"Patterned functionalization layer for sub-μL DNA solid-phase immobilization and hybridization","4","0.5062586069107056"
"Quantitation of non-amplified genomic DNA by bead-based hybridization and template mediated extension coupled to alkaline phosphatase signal amplification","4","0.5150632858276367"
"Integration of plasmid DNA purification and molecular therapy agent preparation using aqueous two-phase systems","4","0.5947436094284058"
"Optimal design of a number of membrane reactors in series using Michaelis-Menten one-substrate reversible kinetics","4","0.5908020734786987"
"Reversed micellar membrane bioreactor","4","0.4898138642311096"
"Manufacturing of bacteriophages for therapeutic applications","3","0.5400011539459229"
"Use of an E. coli pgi Knockout Strain as a Plasmid Producer","0","0.3823586702346802"
"Use of ImageJ to Recover Information from Individual Cells in a G Protein-Coupled Receptor Assay","3","0.5638234615325928"
"Towards a high-throughput drug discovery platform for the screening of GPCR targets in cells","3","0.5252202749252319"
"Electric field pulse assisted covalent immobilization and hybridization of DNA in the nanosecond time scale for genetic information analysis","3","0.5542924404144287"
"Solubility Studies and Synthesis of Acpheleunh2 in Reversed Micellar Systems","3","0.4986247420310974"
"Optimal design of N CSTRs in series using Michaelis-Menten one-substrate reversible reaction","3","0.6544880270957947"
"Fusions of a carbohydrate binding module with the small cationic hexapeptide RWRWRW confer antimicrobial properties to cellulose-based materials","2","0.5738356709480286"
"Minicircle‐based expression of vascular endothelial growth factor in mesenchymal stromal cells from diverse human tissues","2","0.5849736928939819"
"Plasmid Copy Number of pTRKH3 in Lactococcus lactis is Increased by Modification of the repDE Ribosome‐Binding Site","2","0.5272331237792969"
"Amorphous silicon thin-film transistors gated through an electrolyte solution","2","0.5164362788200378"
"Intermediate recovery of plasmid DNA using tangential flow filtration","2","0.4742557406425476"
"On-chip control of DNA immobilization and hybridization with nanosecond electric field pulses","2","0.5138849020004272"
"Covalent immobilization of DNA and hybridization on microchips by microsecond electric field pulses","2","0.5470817685127258"
"Essential guides for isolation/purification of nucleic acids","2","0.37200498580932617"
"Continuous production and in situ extraction of isovaleraldehyde in a membrane bioreactor","2","0.5173037648200989"
"Modeling of membrane bioreactors","2","0.472931832075119"
"Process for Production and Purification of Plasmid DNA","2","0.541854977607727"
"Primary purification of plasmid DNA using differential isopropanol precipitation","1","0.5301399230957031"
"Use of Enzymes in the Downstream Processing of Biopharmaceuticals","1","0.6140347123146057"
"Optical properties of metal nanoparticles embedded in amorphous silicon analysed using discrete dipole approximation","1","0.38804107904434204"
"Preparation of liposome membrane adsorbers and testing for plasmid purification","1","0.4842336177825928"
"G Protein-coupled Receptor Screening Assays: Methods and Protocols","1","0.6116068363189697"
"Thin-film amorphous silicon photodiodes with integrated fluorescent filters for monitoring live-cell G-protein coupled receptors (GPCR)","1","0.49270474910736084"
"Streaming current measurements in micro and nanofluidic channels for label-free multiplexed genomics diagnostics","1","0.4757946729660034"
"Spectral selectivity constraints in fluo‐rescence detection of biomolecules using amorphous silicon based detectors","1","0.5792871713638306"
"Evidence for the in vivo expression of a distant downstream gene under the control of ColE1 replication origin","1","0.44268307089805603"
"ADVANCES IN DNAVACCINATION: DESIGN, IMMUNOLOGY AND MANUFACTURING","1","0.5635626316070557"
"Developing a vaccine for African trypanosomiasis: only wishful thinking or a definite possibility?","1","0.45548945665359497"
"Electrical and Chemical Control of Surfaces for DNA Immobilization and Hybridization","1","0.5686671733856201"
"Fluorescence detection of DNA hybridization using an integrated thin-film amorphous silicon nip photodiode","1","0.5633817911148071"
"Gene delivery using non-viral vectors: Trace impurities in plasmid DNA preparations can strongly affect transfection of mammalian cells","1","0.5317074656486511"
"Targeting antigens to the major pathways of presentation and processing of antigens: A strategy to obtain improved DNA vaccines","1","0.5843952298164368"
"Optimisation of precipitation steps for the purification of plasmid DNA","1","0.4871219992637634"
"Electric field pulse assisted covalent immobilization and hybridization of DNA in the nanosecond time scale","1","0.5476198792457581"
"Appendix 1. Essential Guides for Isolation/Purification of Nucleic Acids","1","0.5211493968963623"
"Temperature, pH and Media Influence on Lipase Stability","1","0.5352765321731567"
"Maximizing mRNA vaccine production with Bayesian optimization","0","0.5357083082199097"
"Scalable purification of single stranded DNA scaffolds for biomanufacturing DNA-origami nanostructures: Exploring anion-exchange and multimodal chromatography","0","0.4611986577510834"
"Recombination efficiency measurement by real-time PCR: A strategy to evaluate ParA-mediated minicircle production","0","0.5348777174949646"
"Monitoring Intracellular Calcium in Response to GPCR Activation: Comparison Between Microtiter Plates and Microfluidic Assays","0","0.5623530149459839"
"Purification of Plasmid DNA by Multimodal Chromatography","0","0.5540164113044739"
"High copy number plasmid engineering for biopharmaceutical-grade pDNA production in Lactococcus lactis","0","0.497862845659256"
"Back Cover Picture: Biotechnology Journal 8/2019","0","0.5745315551757812"
"Cover Picture: Biotechnology Journal 8/2019","0","0.5745549201965332"
"Enhanced-Fluorescence of a Dye on DNA-assembled Gold Nano-Dimers Discriminated by Lifetime Correlation Spectroscopy","0","0.5334681272506714"
"Purification of minicircles by combined enzymatic modification of miniplasmid topology and multimodal chromatography","0","0.40886595845222473"
"Paper microfluidics for the detection of infectious diseases","0","0.4487234055995941"
"Improvement of DNA minicircle production by optimization of the secondary structure of the 5â ²-UTR of ParA resolvase","0","0.46732839941978455"
"Use of DNA stabilizers to extend plasmid biological activity","0","0.48864221572875977"
"FRAP biophysical tool to probe nucleic acids-membrane ligand interactions in pDNA purification","0","0.6258461475372314"
"Euromembrane Conference 2012 [P1. 110] Toward therapeutic plasmids purification by hydrophobic interaction membrane chromatography","0","0.5293587446212769"
"Integrated on-chip photodetection of intracellular calcium in response to the activation of G-protein coupled receptors","0","0.5656723976135254"
"Identification of IS2 transposition in pVAX1-based plasmid, a common vector for DNA vaccine development","0","0.5630526542663574"
"Preferential transposition of the mobile element IS2 into AT-and GC-skew polarity switches","0","0.6039424538612366"
"Microspot-based ELISA in microfluidics: chemiluminescence and colorimetry detection using integrated thin-film hydrogenated amorphous silicon photodiodes (vol 11, pg 4063, 2011)","0","0.5159289836883545"
"GENETIC IMMUNIZATION AS OPPORTUNITY FOR VACCINE DEVELOPMENT AGAINST AFRICAN TRYPANOSOMIASlS.","0","0.6018872261047363"
"Enzymatic biosensors with integrated thin film a-Si: H photodiodes","0","0.5845537185668945"
"Miniaturization of Immunoassays Using Optical Detection with Integrated Amorphous Silicon Photodiodes","0","0.5329868197441101"
"Electric Field Assisted DNA Surface Reactions on the Sub-ms Timescale","0","0.5714496374130249"
"Replacement of nuclease labile sequences in the origin of replication of plasmid vectors can significantly improve transgene expression","0","0.5544506907463074"
"Histidine-agarose chromatography: Effect of plasmid DNA structure and topology on retention","0","0.5383795499801636"
"Kanamicin-induced recombination in E-coli cells harbouring plasmids with direct repeats","0","0.5611565113067627"
"Stabilization of plasmid DNA against mechanical damage","0","0.5799557566642761"
"DNA Vaccines","0","0.45655202865600586"
"On-Chip Detection of Chemiluminescent Biomolecules using an Integrated Thin Film Silicon Photodiode","0","0.5928585529327393"
"Determination of plasmid content in eukaryotic and prokaryotic cells using Real-Time PCR","0","0.48913612961769104"
"Kanamicin-induced adaptive mutation in E. coli cells harbouring plasmids with direct repeats","0","0.4793315827846527"
"a-Si: H Electrolyte-Gate Thin Film Devices for Biological Applications","0","0.49916112422943115"
"Performance of Thin-film a-Si: H Microresonators in Dissipative Media","0","0.5241413116455078"
"Plasmid DNA production","0","0.47572264075279236"
"Overcoming the nuclease barrier to gene expression during trafficking of plasmid DNA vectors","0","0.5847381949424744"
"Electrolyte-Gate a-Si: H Thin Film Transistors","0","0.5215467214584351"
"Thin film silicon microbridges for DNA detection","0","0.5645761489868164"
"Enzyme biocatalysis in AOT/isooctane reversed micelles","0","0.6144281029701233"
"Optoelectronic detection of DNA molecules using an amorphous silicon photodetector","0","0.5699325799942017"
"BIOCATALYSTS AND BIOREACTOR DESIGN-A Multiphasic Hollow Fiber Reactor for the Whole-Cell Bioconversion of 2-Methyl-1, 3-propanediol to (R)-b-Hydroxyisobutyric Acid","0","0.525515615940094"
"The Second International Conference on Protein Stabilisation, 9–12 April 2000, Lisbon","0","0.5615553855895996"
"Organic media selection for the extraction of β-hydroxyisobutyric acid produced by microbial biotransformation","0","0.5054445862770081"
"Biotransformations in two-liquid-phase systems-mechanisms, implications and adaptations","0","0.4469638764858246"
"A biorecognition approach for surface modification of cellulose-based hydrogels using versatile derivatives of carbohydrate-binding modules","0","0.5607342720031738"
"Navigation Bar","0","0.5656921863555908"
"G Protein-Coupled Receptor Screening Assays","0","0.6118889451026917"
"Structural instability in plasmid vectors for DNA vaccination","0","0.40090835094451904"
"Tip-selective functionalization of gold nanorods with dye-labeled DNA’s for effective fluorescence enhancements","0","0.5838605761528015"
"CHALLENGES AND LATEST TRENDS","0","0.576644241809845"
"555 Wiring diagrams in biology: towards the standardized representation of biological information","0","0.4521960914134979"
"Design, construção e produção de minicírculos como vectores de entrega de genes","0","0.5872207880020142"
"BEHAVIOUR OF HORSERADISH PEROXIDASE IN AOT REVERSED MICELLES","0","0.5801461338996887"
"Bioprospeção de inibidores de DNase I para aplicação no desenvolvimento de vacinas de DNA","0","0.5760688781738281"
"Carbohydrate binding modules as a generic tool to anchor biomolecules and metal nanoparticles on the surface of paper-based biosensors","0","0.5847464799880981"
"Pilot scale purification of Food Enzymes with Expanded Bed Chromatography","0","0.5040930509567261"
"Based Microfluidics for Molecular Diagnostics: Immobilization of biomolecules in wax-printed microfluidic channels via CBM3-ZZ chimeric protein","0","0.5512551665306091"
"Fatality in mice due to oversaturation of cellular microRNA/short hairpin RNA pathways","1976","0.3745495080947876"
"Novel tools for production and purification of recombinant adenoassociated virus vectors","842","0.4262230694293976"
"In vitro and in vivo gene therapy vector evolution via multispecies interbreeding and retargeting of adeno-associated viruses","642","0.4446002244949341"
"The 37/67-kilodalton laminin receptor is a receptor for adeno-associated virus serotypes 8, 2, 3, and 9","501","0.4098057746887207"
"Fate tracing of mature hepatocytes in mouse liver homeostasis and regeneration","432","0.27377739548683167"
"From virus evolution to vector revolution: use of naturally occurring serotypes of adeno-associated virus (AAV) as novel vectors for human gene therapy","423","0.49648192524909973"
"Helper virus-free, optically controllable, and two-plasmid-based production of adeno-associated virus vectors of serotypes 1 to 6","381","0.5078783631324768"
"DNA helicase-mediated packaging of adeno-associated virus type 2 genomes into preformed capsids","379","0.3119318187236786"
"CRISPR/Cas9‐mediated genome engineering: an adeno‐associated viral (AAV) vector toolbox","291","0.5918844938278198"
"Subcellular compartmentalization of adeno-associated virus type 2 assembly","279","0.4035247564315796"
"Expression of shRNA from a tissue-specific pol II promoter is an effective and safe RNAi therapeutic","265","0.5216432809829712"
"Six RNA viruses and forty-one hosts: viral small RNAs and modulation of small RNA repertoires in vertebrate and invertebrate systems","264","0.3482597768306732"
"Macrophage microRNA-155 promotes cardiac hypertrophy and failure","256","0.42970749735832214"
"Therapeutic application of RNAi: is mRNA targeting finally ready for prime time?","241","0.40115946531295776"
"Small silencing RNAs: state-of-the-art","240","0.4317536950111389"
"Progress in adeno-associated virus type 2 vector production: promises and prospects for clinical use","237","0.4596240520477295"
"Argonaute proteins are key determinants of RNAi efficacy, toxicity, and persistence in the adult mouse liver","236","0.3603391945362091"
"Preclinical in vivo evaluation of pseudotyped adeno-associated virus vectors for liver gene therapy","236","0.4577009677886963"
"Titration of AAV-2 particles via a novel capsid ELISA: packaging of genomes can limit production of recombinant AAV-2","216","0.417188435792923"
"Purification of recombinant adeno-associated virus by iodixanol gradient ultracentrifugation allows rapid and reproducible preparation of vector stocks for gene transfer in the nervous system","215","0.43334460258483887"
"Single-cut genome editing restores dystrophin expression in a new mouse model of muscular dystrophy","182","0.3676030933856964"
"Silencing of hepatic fatty acid transporter protein 5 in vivo reverses diet-induced non-alcoholic fatty liver disease and improves hyperglycemia","175","0.3133455812931061"
"Combinatorial RNAi: a winning strategy for the race against evolving targets?","171","0.46623802185058594"
"Improved cardiac gene transfer by transcriptional and transductional targeting of adeno-associated viral vectors","171","0.42221716046333313"
"Immune genes are primed for robust transcription by proximal long noncoding RNAs located in nuclear compartments","158","0.35524311661720276"
"Engineered anti-CRISPR proteins for optogenetic control of CRISPR–Cas9","149","0.45575153827667236"
"Production methods for gene transfer vectors based on adeno-associated virus serotypes","135","0.5574938058853149"
"RNAi and gene therapy: a mutual attraction","128","0.4499296247959137"
"Liver transduction with recombinant adeno-associated virus is primarily restricted by capsid serotype not vector genotype","128","0.3252067267894745"
"AAV capsid library and AAV capsid proteins","38","0.4781847596168518"
"Therapeutic short hairpin RNA expression in the liver: viral targets and vectors","112","0.3769262135028839"
"E pluribus unum: 50 years of research, millions of viruses, and one goal—tailored acceleration of AAV evolution","107","0.6341977119445801"
"A two-hybrid screen identifies cathepsins B and L as uncoating factors for adeno-associated virus 2 and 8","106","0.4974449872970581"
"In vivo hepatic reprogramming of myofibroblasts with AAV vectors as a therapeutic strategy for liver fibrosis","105","0.3963651657104492"
"Small but increasingly mighty: latest advances in AAV vector research, design, and evolution","103","0.4773418605327606"
"Thermodynamic stability of small hairpin RNAs highly influences the loading process of different mammalian Argonautes","101","0.3990382254123688"
"Molecular dissection of human Argonaute proteins by DNA shuffling","98","0.3692857623100281"
"CRISPR genome engineering and viral gene delivery: a case of mutual attraction","92","0.6035925149917603"
